2004-06-08T23:18:00Z, Maineville, OH, Light, , "Sshooting star but then it started going in the opposite direction, then down, then it was gone. ((NUFORC Note: Satellite? PD))", 6/18/2004
2004-05-23T08:00:00Z, Ohio (In-flight), OH, Sphere, 5seconds, white sphere fly-by seen from window of commercial jet, 6/4/2004
2004-05-21T00:00:00Z, Harrison, OH, Changing, 1 hour &51 minutes, "The object was directly over my car, sitting still in the air and shining two white beams of light down on me.", 6/4/2004
2004-05-14T22:30:00Z, Strongsville, OH, Light, 6 seconds or so, It started off almost right above me and ended up all the way across the sky and then seemed to hit something and made a 90 degree turn, 6/4/2004
2004-05-14T11:30:00Z, Valley City, OH, , one hour, I lost one hour of time this morning., 6/4/2004
2004-05-14T10:39:00Z, Valley City, OH, , one hour, "A self-employed contractor working in Medina, Ohio area reported that he could not account for an hour of time after powering washing a", 8/11/2004
2004-05-10T01:00:00Z, Hamilton, OH, Disk, 10-15min, Black Area In Night Sky, 6/4/2004
2004-05-08T21:00:00Z, Minford, OH, Other, 45 minutes, Disc object with off shooting tubular lights, 11/2/2004
2004-05-08T11:45:00Z, Cleveland, OH, Light, 30sec., "a fast light that stoped in the sky, a shooting star could not do that said my husband", 6/4/2004
2004-05-08T00:00:00Z, Warren, OH, Light, Five Minutes, I seen on the weather station that we had 11thousand ceiling hight and it was bright Light that I seen. It was very fast light and it w, 5/10/2004
2004-04-25T21:00:00Z, Troy, OH, Disk, 2 minutes, "The thing was a disk that flew very low to the ground, compared to a plane, and went over some trees", 6/4/2004
2004-04-22T00:10:00Z, Louisville, OH, Unknown, Approx 20 min, "Woke up by extreme bright light - object had red, yellow, green, and blue lights moved in a circular motion. Followed electrical towers", 6/4/2004
2004-04-18T15:00:00Z, Beavercreek, OH, Sphere, 15-20 seconds, White balloon-like white ball travelling against heavy winds., 4/27/2004
2004-04-15T00:00:00Z, Columbus, OH, Light, 15 min, "two lights, side by side, fast and gliding. No strobes were on it. We saw over 10 go by, all out of same direction. They are flying", 4/27/2004
2004-04-04T23:00:00Z, New Philidelphia, OH, Light, 45 Min., "The pictures show pink, red and, green hazes around the bright light, with a star off in the distance.", 4/9/2004
2004-03-28T21:30:00Z, Chesapeake, OH, Light, 10 minutes, There were bright lights in strange formation, 3/29/2004
2004-03-24T19:00:00Z, Russia, OH, Fireball, 5 seconds, orangish fireball, 3/28/2004
2004-03-23T20:00:00Z, Russia, OH, Fireball, 5 seconds, Driving down St. Rt. 48 and saw an orangish/redish fireball shoot through the sky. ((NUFORC Note: Student rept. PD)), 3/28/2004
2004-03-21T19:00:00Z, Columbus, OH, Orb, several minutes, White orb silently passing over metropolitan area, 4/9/2004
2004-03-19T23:15:00Z, Sheffield Lake, OH, Disk, 3 min., Paced the UFO for about 3 minutes at 30 mph., 3/23/2004
2004-03-17T23:50:00Z, Columbus (south on US 23), OH, Unknown, 6-10 seconds, 2 balls of red pulsing light 1 small blinking.Near aep power plant., 3/23/2004
2004-03-11T21:00:00Z, Ontario, OH, Triangle, 40 seconds, Very large noiseless triangular craft glides slowly south across Ohio's evening March sky near Mansfield -Ontario area, 4/27/2004
2004-03-11T21:00:00Z, Ontario, OH, Triangle, 40 seconds, "Large triagular craft glided slowly across Rt. 309 in southwestern direction that points toward Columbus, Ohio area", 8/24/2004
2004-03-09T22:30:00Z, Fostoria, OH, Triangle, 2 minutes, "Triangle shaped object, no sound, no trail, glided over my town", 3/17/2004
2004-03-09T19:00:00Z, Shelby, OH, Light, 3 hours, Bright white changed to yellow-orange light moving very fast several lights around it followed by a very low shooting star., 3/17/2004
2004-03-01T21:30:00Z, Garrettsville, OH, Light, 15 minutes, Light next to house and out above treeline., 3/17/2004
2004-02-28T20:00:00Z, Brunswick Hills, OH, Light, 2 Hours, Bright Light - That turns into a Saw Blade Shape when videotaped by a Digital Video Camera. ((NUFORC Note: Sirius??)), 3/2/2004
2004-02-25T19:20:00Z, Bellevue, OH, Disk, 3 minutes, "Small disk-shaped object with numerous green lights, moved left and right slowly.", 3/2/2004
2004-02-24T23:00:00Z, Dayton, OH, Triangle, 10 seconds, 3 lights in triangular formation, 4/27/2004
2004-02-17T20:00:00Z, Centerville, OH, Diamond, 10:00pm, ufo sighting in centerville ohio, 3/2/2004
2004-02-11T08:22:00Z, Lyndhurst, OH, Cigar, 10 seconds, silver metallic wing less cigar rapidly moved north while presenting side on view and dissapeared., 2/12/2004
2004-02-10T05:15:00Z, Mansfield, OH, Other, 3 SECONDS, "THE OBJECT WAS STREAKING, THEN VANISHED", 2/12/2004
2004-02-04T19:00:00Z, Northfield, OH, Orb, 20 minutes, "Many objects appearing to be spheres, made up of erratic squiggly lines at various altitudes.", 2/12/2004
2004-01-24T22:30:00Z, Columbus, OH, Oval, 15-20 sec, 5-7 objects flying in formation, 1/31/2004
2004-01-15T20:00:00Z, Wheelersburg, OH, Light, 1.5 hr., "Bright orange, red, blue, white light in the night sky", 1/17/2004
2004-01-04T17:00:00Z, Toledo, OH, Changing, 10min, it was black and seemed to get smaller, 2/12/2004
2003-12-28T16:30:00Z, Conesville, OH, Light, presently occuring, "unknown object seen over Conesville, Ohio powerplant seen from Fresno, Ohio.", 1/17/2004
2003-12-27T20:10:00Z, Lucasville, OH, Unknown, 1 hour, "The unknown object hovered in the vicinity of the Portsmouth Regional Airport for a hour to a hour and half. It had blue, red, and whi", 1/17/2004
2003-12-27T20:05:00Z, Lucasville, OH, Unknown, 1 hour, MUFON/OHIO REPORT: The unknown obj hovered in the vic of the Portsmouth Reg Airport for 90 min.., 3/17/2004
2003-12-26T15:00:00Z, Beavercreek, OH, Changing, 30 minutes, We saw 3 extremely bright objects that left contrails straight out of the sky then suspended in place and shifted positions, 1/17/2004
2003-12-26T15:00:00Z, Beavercreek, OH, Disk, 30 minutes, "Saucer rims were seen near Beavercreek, Ohio on December 26, 2003", 1/17/2004
2003-12-21T19:52:00Z, Warren, OH, Light, ongoing, Hovering lights in sky followed by jets around the area, 1/17/2004
2003-12-20T19:16:00Z, Garfield Heights, OH, Other, 2 min, Boomerang shaped object 100-200ft in size at 250 to 300ft altitude with a speed of 25 to 40 mph directly overhead., 1/17/2004
2003-12-15T08:45:00Z, Alger, OH, Other, brief, BANK OF LIGHTS IN THE SKY., 1/17/2004
2003-12-12T22:00:00Z, Hillsboro, OH, Light, 5 minutes, Orange-ish colored light balls appear (probably flares), 12/19/2003
2003-12-08T23:00:00Z, Beachwood, OH, Unknown, 20 minutes, massive sound that shook the house, 12/19/2003
2003-12-02T06:40:00Z, Pataskala, OH, Unknown, 10 minutes, I was bowhunting before dawn and the field in front of me was suddenly illuminated from an unknown source., 12/9/2003
2003-12-01T12:07:00Z, Reynoldsburg, OH, Cylinder, 1 minute, "Cylinder shaped object moving east appearing behind jet contrails, reflecting daylight inconsistently.", 12/9/2003
2003-11-25T23:00:00Z, Warren, OH, Triangle, sighting, it was silent and so low you could seee everything, 3/2/2004
2003-11-22T21:00:00Z, N. Ridgeville, OH, Cigar, 40 minutes, Huge white cigar shaped craft hovered in my front yard for an extended period of time., 12/9/2003
2003-11-21T20:30:00Z, Barnesville, OH, Formation, 8 seconds, "the object distorted the visible sky yet you could see through it and it was boomerang shaped, very fast, and silent.", 11/26/2003
2003-11-21T03:00:00Z, Dayton area, OH, Light, 15 -20 seconds, 3 white circular lights flying in a triangle formation, 12/9/2003
2003-11-18T22:00:00Z, Chillicothe, OH, Changing, 3 hrs, "Object changed colors and shapes, divided at one point ((NUFORC Note: Sirius?? PD))", 12/9/2003
2003-11-14T17:30:00Z, Niles, OH, Circle, presently ocurring, "Objects were soft blue in color, formation appeared as fuzzy clouds. They did not make any sound, hovered and frequently criss crossed", 11/26/2003
2003-11-14T17:30:00Z, Niles, OH, Circle, presently ocurring, "MUFON/OHIO FOLLOW-UP REPORT: People followed and watched by objects in Niles, Ohio", 1/17/2004
2003-11-12T01:00:00Z, Huber Heights, OH, Unknown, over 30days, The objects moved in a fasion not consistent with conventional aircraft and were completely silent., 11/26/2003
2003-10-30T21:00:00Z, Findlay, OH, Unknown, 15 minutes, Strange Jet, 11/26/2003
2003-10-30T07:10:00Z, Sagamore Hills, OH, Light, 15 minutes, "At about 7:10 PM on the 30th of October, halloween(halloween was changed to the 30th in this area because of a major football playoff g", 10/31/2003
2003-10-30T04:00:00Z, Solon, OH, Other, 10 seconds, Cream (light tan) colored half circle near Richmond Rd. Aurora Rd Intersection north of Hillcrest Memorial Park Cemetary., 11/11/2003
2003-10-25T22:40:00Z, Trotwood, OH, Other, 2 mins., "MUFON/OHIO FOLLOW-UP INVESTIGATION REPORT: I spoke with the witness from Trotwood, Ohio (suburb of Dayton).", 12/9/2003
2003-10-25T22:40:00Z, Trotwood, OH, Other, 2 mins, I saw a object hoovering approx 6 - 8 feet above some trees as I was approaching a 4 way stop., 10/31/2003
2003-10-21T21:10:00Z, Chillicothe, OH, Fireball, 3 sec, Bright green light streaks twice in Ohio sky between Waverly and Chillicothe on clear night., 10/31/2003
2003-10-18T21:00:00Z, West Chester, OH, Chevron, About 1 minute, "Several strange aircraft, directed light my direction and retreated when spied upon with telescope..", 10/31/2003
2003-10-16T18:30:00Z, Buckeye Lake, OH, Light, 2 mins, Weird lights in the early evening sky around Buckeye Lake and thornville area, 10/17/2003
2003-10-16T18:00:00Z, Columbus, OH, Light, 15 minutes, "Bright, slow moving light.", 10/31/2003
2003-10-15T23:30:00Z, Delaware, OH, Light, 2-3 seconds, Flashing Large lights like intense headlights on the bedroom wall over my bed at night!, 12/9/2003
2003-10-15T20:45:00Z, Hamilton, OH, Diamond, 10 minutes, Detailed sighting in Southwest Ohio a little over an hour after the Collinsville sighting., 11/8/2003
2003-10-15T19:25:00Z, Collinsville, OH, Light, 10 minutes, Several UFOs reported in southwest Ohio over several days and this may be another sighting., 10/31/2003
2003-10-15T18:00:00Z, Westerville, OH, Unknown, 40 minutes, "UFO over Westerville, Ohio?", 5/24/2005
2003-10-13T23:15:00Z, Zanesville, OH, Rectangle, 3 minutes, Very large object w/ white and blue flashing lights.., 10/31/2003
2003-10-13T21:30:00Z, Trenton, OH, Other, 2.5 to 3 minutes, "Strange ""Passenger Jets""", 10/15/2003
2003-10-13T00:00:00Z, Dayton (WPAFB), OH, , , Possible explanation for 10/13 Weird Aircraft Siting, 10/31/2003
2003-10-05T18:30:00Z, Wapakoneta, OH, Light, 20 mins, Strobing Red-White-Blue lights splitting in the sky., 10/7/2003
2003-10-03T06:45:00Z, Madison, OH, Light, 5 seconds, Bright white light abruptly disappears in identical fashion as other examined tapes of UFO's, 10/7/2003
2003-10-01T23:00:00Z, Circleville, OH, Light, 5-10 min., "Bright orange lights go on, and off in Circlville, OH.", 1/17/2004
2003-10-01T18:15:00Z, Perry Township, OH, Cigar, 20 min, an object appeared to get larger then smaller till it disappeared, 4/30/2004
2003-09-26T00:30:00Z, Centerville, OH, Chevron, 1 minute, Very LargeSilent Dark Aircraft, 9/28/2003
2003-09-24T11:32:00Z, South Point, OH, Light, 30 min, "3 objects that look like stars, except stars don't have red and blue flashing lights. 2 of them dissapeared after a few minutes but th", 9/28/2003
2003-09-15T00:00:00Z, Columbus, OH, Other, 5 to 10 minutes, "Large black cube shaped UFO spotted; Columbus, OH. Time seemed to stop!", 6/12/2008
2003-09-15T22:30:00Z, Trenton, OH, Fireball, 0.7 to 0.9 sec.?, "A large, green, flare like or meteor like object.", 9/17/2003
2003-09-15T22:00:00Z, Columbus, OH, Unknown, , "a large craft, disapered lots of lights not blinking.", 6/23/2004
2003-09-12T21:07:00Z, Malvern, OH, Light, 2 days, green white and red flashing lights in the sky, 9/17/2003
2003-09-11T22:00:00Z, Toledo, OH, Triangle, 2min., the craft came from the south at a very low speed an turned to the north east . it didnt bank like a plane but more like a sweep, 1/17/2004
2003-09-11T19:50:00Z, Springfield, OH, Oval, 30 minutes, 3 lighted oval aircraft dissapears, 5/24/2005
2003-09-11T01:30:00Z, Barberton, OH, Light, , "Bright objects over Barberton, Ohio", 9/17/2003
2003-08-30T14:00:00Z, Columbus, OH, Formation, 15 minutes, "Formation of five points of lights in daylight, hovering and changing foramtion, comparable to satalites in brightness, rising up until", 9/4/2003
2003-08-28T01:30:00Z, Delaware, OH, Light, 10 mins, "Staying up late is sometimes a part of being a student! Right before going to sleep, after spending several hours of reading, I often", 9/4/2003
2003-08-27T22:00:00Z, Akron, OH, Circle, 20 seconds, We saw 2 bright stars that were stationary and started moving (keeping the same distance apart) and disappeared after 15-20 seconds., 9/4/2003
2003-08-27T21:15:00Z, Marblehead, OH, Flash, 90 minutes, over a 90 min. span of time 10-20 objects flashing and moving very fast traveled across thesky., 9/4/2003
2003-08-27T02:00:00Z, Stryker, OH, Flash, 2 min, An object of light that had a 20 second span between flashes directly above me that seemed to be going up and away from me as each time, 9/4/2003
2003-08-26T22:30:00Z, Patriot, OH, Orb, 20 seconds, bright light flashed on and off, 8/28/2003
2003-08-25T04:45:00Z, Sunbury, OH, Triangle, 15 MIN, "Large, red triangle over Delaware County.", 8/28/2003
2003-08-25T00:30:00Z, Maumee, OH, Cone, 0040am, cone shape with lights, 8/28/2003
2003-08-22T23:00:00Z, Hillsboro, OH, Disk, 15 MIN, UFO SPOTTED THEN CROP CIRCLE APPEARS, 9/9/2003
2003-08-22T21:30:00Z, Columbus, OH, Changing, 15-20 seconds, "One large bright light, very low, in the Southwest part of sky, light dimmed, then seemed to turn into 3 smaller black craft that follo", 9/17/2003
2003-08-21T21:05:00Z, Bethel, OH, Disk, 5 minutes, rapidly flashing light with VERY erratic movements appearing to cover great distances and lasting several minutes, 8/28/2003
2003-08-13T21:50:00Z, Delaware, OH, Unknown, 1 minute, This object seen in the same general Westerly direction of the report I filed last week. This is now the third or fourth time since mo, 8/28/2003
2003-08-13T10:30:00Z, Springfield, OH, Oval, 15 second, ufo seen in ohio, 5/24/2005
2003-08-10T20:00:00Z, Harpersfield, OH, Triangle, 3-4 minutes, This happened when I was around 18 years old. I was coming home from a friends house between 8 or 9 o'clock down lafever road and I loo, 7/3/2013
2003-08-10T01:00:00Z, Hamilton, OH, Light, 5 Minutes, White lights Flying erratically, 8/28/2003
2003-08-03T23:00:00Z, Toledo, OH, Light, 4 hours, odd flashing group of lights seen in toledo, 10/7/2003
2003-08-01T21:00:00Z, Galloway, OH, Light, Minutes, Sudden bright lights/missing time, 12/22/2022
2003-07-30T02:30:00Z, Delaware, OH, Changing, 30minutes, Dancing light in the sky appeared like a star but then changed colors and positions rapidly unlike a plane, 8/28/2003
2003-07-20T01:00:00Z, Marengo, OH, Triangle, 5 minutes, UFO Hoovered over home, 2/14/2006
2003-07-19T23:00:00Z, Stryker, OH, Triangle, 5sec, "I noticed this triangular, dimmly lit object traveling from East to West, covering abot 90 degrees in about 4-5 sec. No sound", 7/23/2003
2003-07-17T21:00:00Z, Novelty, OH, Fireball, 1 minute, A basketball-sized bright light struck my car as we drove, 4/23/2021
2003-07-15T20:00:00Z, St. Loisville, OH, Oval, 5-10 minutes, I witnessed a huge gray ball of light follow an airplane until they both were out of my eye sight., 11/6/2014
2003-07-12T19:50:00Z, Fairborn, OH, Cigar, 2 minutes, "cigar shapped craft, moving very fast and very high;with no contrail!", 7/16/2003
2003-07-01T20:30:00Z, Mentor-on-the-Lake, OH, Triangle, 2-3 seconds, "Group of seven lights in triange formation, silent & disappearing.", 11/21/2014
2003-06-30T23:10:00Z, Hamilton, OH, Flash, 1 - 3 seconds, Witness of reported flash over hamilton, 12/9/2003
2003-06-24T21:00:00Z, Columbus, OH, Light, few seconds, Unknown flash of light., 7/16/2003
2003-06-19T21:00:00Z, Rome, OH, Disk, 3min, "The three disk stood in a triangle formation without making a sound, one blinking red light on the bottom of the disk, departed fast", 7/16/2003
2003-06-06T23:30:00Z, Medina, OH, Oval, 1 hour, I was driving home from work and I saw an object about 100 feet above my head. It was oval shaped with two lights. It was not moving a, 6/10/2003
2003-06-06T22:45:00Z, Sunbury, OH, Light, 20 Seconds, Observed unusual red/white/ and yellow light source in the western sky, 6/10/2003
2003-06-02T03:00:00Z, West Chester, OH, Oval, 15-20 minutes, MUFON/OHIO FOLLOW-UP: A resident of West Chester reports dramatic sighting near his res.that was accompanied by a local power failure., 8/28/2003
2003-06-02T03:00:00Z, West Chester, OH, Oval, 15-20 minutes, Oval craft with two strobing ovals that seemed to be propulsion - bottom of craft was saturated in a deep blue light, 7/16/2003
2003-05-31T23:00:00Z, Bellevue, OH, Light, 45sec., A cloud lit up and changed to different colors in the middle of the night, 6/3/2003
2003-05-14T00:00:00Z, St. Louisville, OH, Oval, , This is a very true and testimonial event that happened in the town I lived in for 3 years. On July 13th or the 14th 2003 around b, 7/16/2006
2003-05-13T22:00:00Z, Grove, OH, Unknown, .05 sec, bright flaring star, 5/27/2003
2003-05-10T21:35:00Z, Cleveland, OH, Disk, 5 min, Seen fast spinning disc with flashing lights., 12/19/2003
2003-05-09T22:30:00Z, Columbus, OH, Disk, north, THERE WAS TWO OF THEM LIGHTS AND NOISE AMAZING SIGHT VERY SCARY, 3/23/2004
2003-05-06T23:00:00Z, Mason, OH, Other, 24:00:00, The object was made out of a silver metal and from far away looked like a shooting star. So my husband and i went outside to watch it., 6/3/2003
2003-05-06T23:00:00Z, Mantua, OH, Other, 24:00:00, "I was at a block party with my husband when i saw a comet looking object in the sky, everyone stoped to gape and many people ran to get", 6/3/2003
2003-05-05T05:00:00Z, Geneva, OH, Sphere, 30 minutes, White sphere follows driver, 8/28/2003
2003-05-03T23:20:00Z, Marietta, OH, Light, 0:05, Bright balls of light over SE Ohio, 5/9/2003
2003-05-03T17:00:00Z, Wooster, OH, Unknown, 2 minutes, "a moving dark cloud, hovers, fades in and out, small visible opening in sky, orange color object appears, ballon material look.disappears..", 7/16/2003
2003-04-18T05:45:00Z, Jackson, OH, Cylinder, 3 or 4 min., we seen a pill shaped object in the sky, 5/27/2003
2003-04-12T03:18:00Z, Delaware, OH, Circle, 3-4 minites, "4-12-03 Delaware, Ohio Large White light across field hovering and zipping in straight lines ""curious""", 5/24/2005
2003-04-02T05:15:00Z, Wapakoneta, OH, Light, 2-3 minutes, "bright light moving through the sky, then rapidly faded away.", 4/22/2003
2003-04-01T05:10:00Z, Wapakoneta, OH, Light, 1-2 minutes, "At work, approx 5:00am (still dark out) I was smoking a cigarette outback with a co-worker when I saw a large bright circular light mov", 4/22/2003
2003-03-29T23:22:00Z, North Royalton, OH, Triangle, 3 min, Me and my friend were in our jacuzi at my house. The lights on our jacuzi change color every 2 or 3 seconds. We saw a light very far, 4/22/2003
2003-03-27T21:30:00Z, Norton, OH, Disk, 15 minutes, 3/2003 UFO in NE Ohio ~A low-flying craft gliding at night that was silent until it was out of sight and about a half mile away, 6/18/2004
2003-03-19T21:25:00Z, Parma, OH, Triangle, 10 minutes, "Triangular craft, from the front you only saw white light, almost invisible in the sky, pyramid characteristics", 5/15/2013
2003-03-15T14:30:00Z, Piqua, OH, Sphere, 5 min, "appeared, moved very fast, lost altitude, vanished.", 3/21/2003
2003-03-10T19:45:00Z, Zaleski, OH, Sphere, 3 seconds, "Orange sphere slowly drops for the Zaleski, Ohio sky.", 3/11/2003
2003-03-10T17:00:00Z, Cedarville, OH, Triangle, 15 seconds, "Spotted hovering in midair perfectly still, then silently accelerated away at great speed", 12/16/2005
2003-03-07T00:15:00Z, Columbus (140 mi ESE of), OH, Triangle, 15s, "Bright lights in triangular pattern 'hang' in sky, then accelerate and fade from view.", 3/11/2003
2003-03-03T22:15:00Z, Cuyahoga Falls, OH, Formation, 3 or 4 seconds, "A dozen or more lights in a ""V"" formation moving quickly and silently.", 3/11/2003
2003-02-27T15:40:00Z, Hudson, OH, Circle, 2/3 minutes, "observed objects for 2-3 min, there were 10-12- of them moving in and out, lined up one headed north then vanished", 3/4/2003
2003-02-12T00:29:00Z, Hamilton/New Miami, OH, Light, A few seconds, on 2-12-2003 at 12:29AM.On the way home from work with my wife we saw freakish flashes of blue lights over HAMILTON & NEWMIAMI OHIO .My, 2/25/2003
2003-02-06T21:00:00Z, Washington Court House, OH, Light, 30 minutes, "Large, round, orange balls of light, followed by fast moving craft in sky with strobe like lights.", 2/11/2003
2003-02-01T09:00:00Z, Delaware, OH, Sphere, 60sec, MORNING TIME SHIP FLY BY, 2/5/2003
2003-01-31T19:30:00Z, Columbus, OH, Other, 30-40 SEC, On Jan. 31st 2003 I believe what I saw classifies as an unidentified flying objects that was hovering over the top of trees in fron, 2/5/2003
2003-01-30T23:00:00Z, Columbus, OH, Teardrop, 30 Seconds, A glowing object past over the columbus zoo late at night, 7/5/2008
2003-01-30T19:15:00Z, Beachwood, OH, Chevron, 30 seconds, "V-shaped light formation over Beachwood, OH", 2/5/2003
2003-01-18T23:00:00Z, Stryker, OH, Rectangle, 5 sec, "I saw something that at first I thought was a shooting star, but then noticed that it was too spread out and dim to be a shooting sar.", 7/23/2003
2003-01-14T20:00:00Z, Lorain, OH, Light, 15 minutes, Crazy light beams in west cleveland area, 2/5/2003
2003-01-09T22:30:00Z, Portsmouth, OH, Cigar, 3-5 seconds, "oblong glowing blue light in the north, then the north east", 2/5/2003
2003-01-08T19:00:00Z, Williamsburg, OH, Other, 5-10 min, Ufo shaped like a plane that could hover levitate and back up., 2/5/2003
2003-01-08T02:36:00Z, Cincinnati, OH, Unknown, 3 seconds, UFO heard fly over teens house and teen hears voices in braces., 2/5/2003
2003-01-07T00:25:00Z, Washington Courthouse, OH, Triangle, 15 minutes, "2 white lights in front, 3 accross back, triangle type aircraft, hovering and slow moving, 800-1000 ft up", 2/5/2003
2003-01-04T21:57:00Z, Medina, OH, Light, 5-7 minutes, January 4 2003-lights in rearview mirror, 2/5/2003
2002-12-25T06:45:00Z, Chesapeake, OH, Light, 30 seconds, green lights changing to blue floor vibrating, 2/14/2006
2002-12-08T21:00:00Z, Vienna, OH, Cigar, 5 minutes, "Vienna, Ohio", 12/23/2002
2002-12-08T04:30:00Z, Brookfield, OH, Unknown, Not Known, I was away for a weekend on a hunting trip when my companion and I retired for the evening. I was in my sleeping bag at 10 pm. I thoug, 12/23/2002
2002-11-27T23:30:00Z, Lakewood, OH, Chevron, 20 seconds, Gossamer V-shaped object seen from Ohio, 12/23/2002
2002-11-20T15:00:00Z, Portsmouth, OH, Cigar, 2 minutes, White Cigar Shape-Daytime, 12/23/2002
2002-11-18T23:00:00Z, Ashville (2 miles south of), OH, Light, 2 sec, lights during a meteor shower.., 3/21/2003
2002-11-15T22:00:00Z, Sheffield Lake, OH, Circle, 3 MIN, A BRIGHT LIGHT WAS MOVING JUST ABOVE THE CLOUDS VERY SLOWLY FROM NORTH TO SOUTH., 12/19/2003
2002-11-13T18:30:00Z, Chillicothe, OH, Other, 1 minute, 8 big ligts in sky, 11/16/2002
2002-10-30T09:15:00Z, Marshallville, OH, Other, 15 seconds, "At a 4 way stop, looking to my left I saw a image, that I first thought was a blimp coming at me at an angle. Realizing it was extremel", 11/4/2002
2002-10-28T19:10:00Z, Lisbon, OH, Disk, 30 seconds, slow moving unexplaned craft, 11/4/2002
2002-10-27T17:00:00Z, Avon Lake, OH, Orb, 3 seconds, White orb descends from the ceiling in my house and disappears. ((anonymous report)), 9/5/2017
2002-10-24T00:00:00Z, Cleveland (?), OH, Cigar, , "On the local news in Tucson they showed film footage of a UFO over a big city, I think Cleveland but am not sure. It was cigar shaped a", 10/28/2002
2002-10-22T20:15:00Z, St. Clairsville, OH, Disk, 15 MINUTES, This object had what seemed to be headlights flashing different colors at the center ofwhat appeared to be a disk-shaped object. On ei, 10/28/2002
2002-10-17T23:01:00Z, Columbus, OH, Circle, approx. 2 mins, behind the clouds and high speeds involved., 10/28/2002
2002-10-16T20:20:00Z, Galion, OH, Triangle, 7-10 minutes, Triangle Hovers over town for 6-8 minutes, 5/24/2005
2002-10-10T20:30:00Z, Cincinnati, OH, Other, 30 minutes, Large octagon blue lights on rim red center light hovers over downtown Cincinnati thursday October 10., 10/15/2002
2002-09-30T18:00:00Z, Huber Heights, OH, Light, 10/min, While driving close home I saw the lights in the sky. Not moving shaped like a tapole. Arriving home I ran in for my camera made two pi, 10/15/2002
2002-09-30T04:00:00Z, Euclid, OH, Disk, 15 minutes, "Round, red, green, bright white object", 10/15/2002
2002-09-27T20:15:00Z, West Chester, OH, Light, 5 to 10 seconds, Light's in the sky, 10/15/2002
2002-09-24T13:00:00Z, Mason, OH, Sphere, 8 minutes, "looked like a star during full daylight--cloudless day. seemed high up, not really moving much", 9/28/2002
2002-09-23T22:30:00Z, Westerville, OH, Light, 3 seconds, Westerville OH September 23 2002 UFO Sighting, 9/28/2002
2002-09-19T23:45:00Z, Louisville, OH, Unknown, 45 sec, unknown aircraft seen trailed at low altitude be helicopter in stark county OH., 9/28/2002
2002-09-17T10:00:00Z, Columbiana, OH, Fireball, 23 minutes, I saw a fireball/disc like shape in the woods., 2/25/2003
2002-09-15T22:00:00Z, Milford, OH, Oval, , The sight was so amazing., 3/4/2003
2002-09-13T21:00:00Z, Columbus, OH, Triangle, 1-2 minutes, "He could clearly make out three lights, with combinations of red and white. ""It was weird. I thought it was 3 planes flying together", 9/19/2002
