2016-06-27T07:00:00Z, Columbus, OH, Sphere, 30 seconds, "Bright sphere, moving slowly then disappears, over Columbus OH", 7/8/2016
2016-06-25T21:45:00Z, Newton Falls, OH, Fireball, 1 second, 1 large red orb going from N to S at approx. 9:45 p.m. on June 25th in Trumbull County Newton Falls Ohio no navigational, 7/8/2016
2016-06-24T22:00:00Z, Novelty, OH, Cigar, 8 minutes, Saw large object after power went out in area., 7/8/2016
2016-06-17T22:47:00Z, Spencerville, OH, Fireball, ~20 minutes, "Several large fireballs over Ohio, near country side.", 6/24/2016
2016-06-16T22:47:00Z, Centerburg, OH, Other, 46 minutes, A blue laser like search light and a dim glowing green figure 3 feet tall., 6/24/2016
2016-06-15T23:00:00Z, Lancaster, OH, Formation, 10 minutes, ((HOAX??)) White lights in saucer like pattern. ((anonymous report)), 6/16/2016
2016-06-15T23:00:00Z, Lancaster, OH, Light, 12 minutes, Very bright lights moving at various speeds., 6/24/2016
2016-06-15T20:25:00Z, Mount Vernon, OH, Circle, 4 minutes, Large bright white light moving up to the sky., 6/16/2016
2016-06-06T23:45:00Z, Columbus, OH, Fireball, Seconds, Large green fireball. ((NUFORC Note: Possible meteor?? Anonymous report. PD)), 6/10/2016
2016-06-03T21:20:00Z, Toledo, OH, Other, 30 minutes, Shape looked like a snake. It changed form several times. Definitely not a balloon. I have photos. No explanation for this., 6/10/2016
2016-05-30T22:15:00Z, Elyria, OH, Sphere, 1 minute, "Bright amber sphere, with one smaller sphere on each side of the craft.", 6/1/2016
2016-05-29T03:00:00Z, Port Clinton, OH, Circle, 1-2 minutes, "Circular object with red, white and blue flashing lights", 6/1/2016
2016-05-25T23:45:00Z, Northfield, OH, Other, 15 minutes, I was on my way home from work and noticed a low flying craft in the sky. It moved extremely slow and at times would stop. I had to tur, 6/1/2016
2016-05-24T18:20:00Z, Geneva, OH, Cigar, 1 minute, White cigar shaped object seen during the day in clear sky., 5/26/2016
2016-05-22T21:30:00Z, Pataskala, OH, Fireball, 20 minutes, "Saw about a dozen balls of fire in the sky, some traveling together, moving north to south in a time frame of about 15-20 minutes.", 5/26/2016
2016-05-20T21:21:00Z, Mentor, OH, Fireball, 2 minutes, "Three orange/red orbs flying west, approximately 3500 ft in the sky, estimated to be traveling 500 mph. Size of orbs possibly a round 3", 5/26/2016
2016-05-03T21:30:00Z, Mantua, OH, Triangle, 25 minutes, "Hovered over neighbors farm for a while, 3+ lights, then became VERY BRIGHT (blinding us). Circled our house a few times and did a 180.", 5/6/2016
2016-04-24T15:00:00Z, Beavercreek, OH, Cone, 3:00 minutes, "On a Sunday afternoon our family and three of my daughter's friends where playing volleyball at the community park behind our house, I", 6/1/2016
2016-04-16T17:00:00Z, Pataskala, OH, Cigar, 2 minutes, Silver object seen by 2 witnesses., 4/22/2016
2016-04-16T15:50:00Z, Lewis Center, OH, Oval, 20 minutes, Thinking at first was either a balloon or then based under the unusual movement of the object we were thinking drone. ((anonymous)), 4/22/2016
2016-04-15T23:17:00Z, Liberty Township, OH, Fireball, 15 seconds, "Fireball appeared in the sky falling towards the earth, then it got bigger and flashed from white to green vanishing over a house.", 4/29/2016
2016-04-15T22:00:00Z, Reading, OH, Fireball, 2 minutes, A bright orange fireball with a faint blue tail came up from the eastern horizon. As it flew over our house it it started to fade., 4/22/2016
2016-04-15T21:30:00Z, Hilliard, OH, Light, 1 minute, Light in upper atmosphere that vanished. No trail. ((NUFORC Note: Probable overflight of International Space Station. Anon. PD)), 4/22/2016
2016-04-15T11:45:00Z, Boardman, OH, Triangle, 20 minutes, Golden flying triangle shakes under rain clouds until finding an opening in the clouds and turned upright and disappered quickly!, 3/10/2017
2016-04-13T23:00:00Z, Brecksville, OH, Triangle, 15 minutes, "Huge Triangle, Brecksville, OH. Could see inside the lowered ""glass"" room.", 9/12/2017
2016-04-13T22:00:00Z, Hamilton, OH, Unknown, now, "Several (10-15) objects spread far apart hovering over Cincinnati area facing SSW. Flashing multi-colored (red, white, blue.", 4/15/2016
2016-04-04T01:49:00Z, Dayton/Fairborn, OH, Light, 0.5 second, "Blue/green light 1:49AM Dayton, OH circular", 4/15/2016
2016-04-03T06:45:00Z, Cleveland, OH, Circle, 5 minutes, There was a white ball flying around my car., 4/15/2016
2016-03-28T09:34:00Z, Elyria, OH, Unknown, 5 seconds, ((HOAX??)) There were three shapes with blinking lights northwest of where I was standing., 4/1/2016
2016-03-26T21:20:00Z, New Lexington, OH, Disk, 2 minutes, I tried to enter the time in the correct box but it would not allow me. But the sighting took place at 9:20 P.M. or 21:20 P.M. Military, 4/1/2016
2016-03-20T11:30:00Z, Cincinnati, OH, Light, 10 minutes, "On Sunday, March 20th 2016 at approximately 11:20 am, I was leaving my house to take my usual exercise walk around the neighborhood. As", 3/24/2016
2016-03-17T01:30:00Z, Franklin Furnace, OH, Flash, 10 minutes, Flash in the sky., 3/18/2016
2016-03-16T00:00:00Z, Huron, OH, Disk, 30 minutes, ((HOAX??)) Red and green lights flying low over Huron High school. ((NUFORC Note: Student report. PD)), 5/4/2018
2016-03-06T20:00:00Z, Columbus, OH, Light, 6 minutes, 12 bright lights following each other over Columbus., 3/11/2016
2016-03-03T22:00:00Z, Columbus, OH, Triangle, 2 minutes, "I went outside to smoke a cigarette and as usual I look up at the sky and something that caught my attention, I saw a bright light just.", 3/4/2016
2016-03-02T22:50:00Z, Jacksonville, OH, Triangle, 2 minutes, 2 side-by-side green lights moving super fast and were super loud., 3/4/2016
2016-03-01T00:00:00Z, Vermilion, OH, Oval, , photograph of object in sky 2016., 3/31/2021
2016-02-22T06:00:00Z, Cincinnati, OH, Light, 2 minutes, Bright light moving south to north very high rate of speed was not a plane brightness of a star, 2/26/2016
2016-02-20T20:00:00Z, Lordstown, OH, Unknown, 21:00, Two large craft hovering over Lordstown (Trumbull/Mahoning County border)., 2/26/2016
2016-02-20T05:07:00Z, Colerain Township, OH, Cylinder, 2 minutes, Cylindrical object in the southern sky with glowing red and white lights in the lower half., 2/26/2016
2016-02-19T22:05:00Z, Newtown, OH, Light, <10 seconds, "A very bright light, brighten than star, appeared then shot off straight, and stopped again., three times then disappeared rapidly.", 2/26/2016
2016-02-19T21:00:00Z, Columbus, OH, Flash, 2 hours, "Over the South side of Columbus, Ohio.", 2/26/2016
2016-02-15T00:20:00Z, Columbus, OH, Flash, Brief, On 71 southbound near the Budweiser plant. A green flash lit the entire sky behind the clouds sort of like heat lightning except it's, 2/19/2016
2016-02-07T06:00:00Z, Pataskala, OH, Circle, 1-2 seconds, Green fireball with a tail that looked like sparks falling towards earth 6AM, 2/11/2016
2016-02-06T21:30:00Z, Akron, OH, Orb, ~90 minutes, "20-30 multicolored fast moving orbs seen over Akron, Ohio.", 2/11/2016
2016-02-06T05:35:00Z, North Canton, OH, Oval, 25 minutes, "Single orange, elliptical object, hovering.", 2/19/2016
2016-02-04T20:07:00Z, Medina, OH, Orb, 5 minutes, Very different colored orb the color was yellowish orange maybe a small amount of red it stayed in place about 3 mins then went west., 3/11/2016
2016-01-28T01:30:00Z, Uniontown, OH, Other, >1 hour, "3 or more objects over Uniontown Ohio. ((NUFORC Note: Possible sighting of a twinkling star, perhaps Sirius?? PD))", 1/29/2016
2016-01-28T00:30:00Z, Concord, OH, Flash, 30 minutes, "Distant stationary object in SE sky, with flashing red and green lights. ((NUFORC Note: Probably Sirius, we suspect. PD))", 1/29/2016
2016-01-24T16:45:00Z, Lancaster, OH, Fireball, 5 minutes, "Large fireball in the sky to the left of the sun, seemed to changed it's shape, and size.", 7/23/2017
2016-01-21T03:00:00Z, North Canton, OH, Fireball, 4-6 minutes, "((HOAX??)) Sound very loud like an engine, shook windows of home. Fireball could be seen in the W sky for @5 min..", 1/23/2016
2016-01-14T18:30:00Z, Burbank, OH, Fireball, 5 minutes, I saw a rather large fireball in the sky that did not move for around five minutes., 1/20/2016
2016-01-12T23:00:00Z, Columbus, OH, Triangle, 20 seconds, L-shaped lights., 1/14/2016
2016-01-05T00:00:00Z, Lordstown (near; on I-80), OH, Light, 3 seconds, "Travelling W on I-80 near Lordstown, OH, I suddenly saw a very bright light just south of the highway. It appears there is a milit", 1/14/2016
2015-12-19T20:50:00Z, McComb, OH, Triangle, 1 minute, Large silent triangular craft., 1/5/2016
2015-12-17T06:15:00Z, Dayton, OH, Disk, 1 minute, Disc like Flying Saucer., 12/17/2015
2015-12-13T06:56:00Z, Columbus, OH, , 1-2 minutes, Flashes light up entire sky., 12/17/2015
2015-12-12T19:41:00Z, Marietta, OH, Circle, 30 seconds, "Round Orange light in sky over Marietta, Ohio and Ohio River. Moving steady with no sound.", 12/17/2015
2015-12-08T17:34:00Z, New Bloomington, OH, Changing, 2 minutes, Object flying with three bright white lights, 12/10/2015
2015-12-07T22:00:00Z, Bexley, OH, Fireball, 2-3 minutes, 2 fiery objects seen above the starbucks in the center of town., 12/10/2015
2015-11-25T21:00:00Z, Sugar Grove, OH, Triangle, 3 minutes, Triangular object observed flying over lake., 11/26/2015
2015-11-22T23:25:00Z, Canton, OH, Triangle, 8 seconds, Letting the dog out I looked up and saw a barely able to be seeing triangular shape of lights moving across the sky from north to south, 11/26/2015
2015-11-22T21:45:00Z, Lucasville, OH, Circle, 5 seconds, We were driving down the road and saw a bright white circle in the sky head straight down. It was Whitish green as it fell straight fr, 11/26/2015
2015-11-22T18:02:00Z, Dayton, OH, Circle, 5-7 seconds, "I was driving southbound on interstate 75 headed to work in Dayton, Ohio at 1805 hrs..", 11/26/2015
2015-11-22T18:00:00Z, Miamisburg, OH, Light, 2 seconds, While driving on Byers Rd. heading to Austin Blvd my daughter and I saw a greenish/blue light flashing across the sky then flash orange, 11/26/2015
2015-11-20T18:45:00Z, Chillicothe, OH, Unknown, 20 minutes, "((HOAX)) 12 aircraft in dogfight firing missles and tracer rounds with laser guidance near Chillicothe, Ohio.", 11/26/2015
2015-11-20T18:22:00Z, west union, OH, Formation, <5 minutes, Saw a series of 4 horizontal orangish lights tracing each other in the sky for a few minutes before they disappeared., 11/26/2015
2015-11-19T22:45:00Z, Springfield, OH, Fireball, 3 seconds, "I had the dogs out to use the restroom, glanced up and saw a ball of bright light with a tail of fire in the southwest sky traveling w", 11/20/2015
2015-11-18T23:10:00Z, New Richmond, OH, Flash, 2 seconds, Looked to be a meteorite but as it appeared to be on it's way down. It shot into another direction almost as it ricochet off of somethi, 11/19/2015
2015-11-17T19:20:00Z, Chardon, OH, Triangle, 5+ minutes, Low-flying triangular craft with white lights and red blinking light seen over Chardon, 11/19/2015
2015-11-14T17:35:00Z, Xenia, OH, Unknown, 10 minutes, "Saw a slow falling object. Downtown Xenia looking towards the Centerville area south west from Xenia. During sunset, noticed a bright p", 11/19/2015
2015-11-13T18:00:00Z, Gary, OH, Sphere, 5 minutes, "6 yellow spheres over Lake Michigan by Gary, Indiana.", 11/19/2015
2015-11-08T22:00:00Z, Columbus, OH, Cigar, 10 seconds, Sitting in hot tub when a brilliant streak of whitish-blueish light flew horizontally across the sky out of nowhere with a quiet whistl, 11/19/2015
2015-11-08T19:40:00Z, Trotwood/Englewood, OH, Light, ~2 minutes, I was taking my dog out and I saw 6 flashing lights in the sky swerving in all directions., 11/19/2015
2015-11-07T22:47:00Z, Gahanna, OH, Formation, 4 minutes, 10 reddish/orange balls of light in the sky., 11/19/2015
2015-11-03T21:30:00Z, Bremen, OH, Formation, 1 minute, "6-8 orange red lights in a horizontal line flying above at low altitude, and low air speed.", 11/6/2015
2015-11-03T20:35:00Z, Hilliard, OH, Circle, 4 minutes, I witnessed about 8 reddish glowing lights in the sky. They hovered in an oblong horizontal pattern and then shifted., 11/6/2015
2015-11-03T19:50:00Z, Campbell, OH, Orb, 9-10 minutes, Several bright green lights in the sky., 11/6/2015
2015-11-02T18:00:00Z, Copley, OH, Triangle, 3 minutes, Triangular shaped craft with bright lights on all 3 sides observed in the Copley/Medina area., 11/6/2015
2015-11-02T16:20:00Z, Cleveland Heights, OH, Triangle, 15 minutes, Triangular neutral-silvery object with 3 circular illuminations in each corner on the underside seen for 15 minutes., 11/6/2015
2015-11-01T20:30:00Z, Toledo, OH, Unknown, >1 hour, "Pulsating red, green blue hovering objects. Watched them for over and hour.", 11/6/2015
2015-11-01T16:30:00Z, Toledo, OH, Light, :30, Too close to be shooting star and too bright and close to be landing plane., 11/6/2015
2015-10-31T20:45:00Z, Chillicothe, OH, Light, 1 minute, 20-30 light in the sky in a group., 11/6/2015
2015-10-27T07:13:00Z, Parma Heights, OH, Circle, 1 minute, Children at bus stop see UFO's surrounding Parma, 10/29/2015
2015-10-26T21:56:00Z, North Ridgeville, OH, Other, Still happening, I was standing outside looking up at the full moon around 9:56pm tonight and i look and i see these blinking and flashing lights in the, 10/29/2015
2015-10-25T17:00:00Z, Hilliard, OH, Circle, 2 minutes, UFO entering portal., 10/29/2015
2015-10-24T20:30:00Z, Dayton, OH, Light, 5 minutes, 6-8 glowing objects in the sky disappear after 5 minutes., 10/29/2015
2015-10-23T10:30:00Z, Mismisburg, OH, Circle, 1 minute, Lights in sky separating and forming back to one. ((NUFORC Note: Possibly advertising lights? PD)), 10/29/2015
2015-10-23T07:02:00Z, Pickerington, OH, Orb, 15 seconds, Bright light traveling at a high rate of speed going east to west., 10/29/2015
2015-10-22T20:30:00Z, Franklin, OH, Circle, 3 minutes, Circular object with vivid red and white lights., 10/29/2015
2015-10-21T18:00:00Z, Cincinnati, OH, , , "Traveling on 275/E in Anderson and seen two orange flickering lights hovering, then disappeared!", 10/29/2015
2015-10-18T19:40:00Z, Medina, OH, Unknown, 15 seconds, "Ohio 10/18/2015 Blurry Object moving NW to SE not of this world, no light just barley visible.", 10/29/2015
2015-10-18T18:00:00Z, Cincinnati, OH, Unknown, 20 seconds, Round bright light over Cincinnati., 11/6/2015
2015-10-17T19:10:00Z, Grove City, OH, Light, 10 minutes, I saw 6 bright reddish lights traveling from northwest to southeast flying in a strange pattern. At firts I thought a plane was crashin, 10/29/2015
2015-10-16T13:30:00Z, North Baltimore, OH, Fireball, Split second, "Video of ""flaming"" object, no trail or noise, streaking across the sky very fast.", 7/5/2019
2015-10-11T00:00:00Z, Springfield, OH, Rectangle, 5 minutes, "Rectangle, bright white on bottom with small flashing red and green on sides, no wings", 10/16/2015
2015-10-10T22:55:00Z, Kettering, OH, Triangle, 4 minutes, I saw a 4 foot triangular craft with a 1-foot diameter bright white light in the center.. The light flashed on and off seven times., 3/18/2016
2015-10-10T04:00:00Z, Kent, OH, Circle, 1 hour, Multicolored round object hovering and moving side to side in an eradic fashion., 10/16/2015
2015-10-09T20:00:00Z, Genoa, OH, Rectangle, 8-10 minute, UFO in Genoa Ohio seen moving to fast to be military or civilian aircraft with strange solid red light in the middle & flashing., 10/16/2015
2015-10-07T20:00:00Z, Monroe, OH, Light, 5 minutes, "Saw a light, no blinking lights cloud level moving northwest. No noise, speed varied from fast to slow.", 10/9/2015
2015-10-06T20:50:00Z, Hamilton, OH, Circle, 1 hour, Circular objects with multi-colored lights seen hovering near Butler County Regional Airport, 10/9/2015
2015-10-05T02:00:00Z, Cortland, OH, Unknown, >15 minutes, 3-4 lights moving in an erratic manner while also moving as a whole unit in a creeping sort of manner toward the north., 10/9/2015
2015-10-04T15:30:00Z, Kenton, OH, Triangle, 15 seconds, no 2 flying objects could follow that perfect path sliding right go straight then sliding left and go straight at that speed then make, 10/9/2015
2015-10-04T09:00:00Z, Athens, OH, Light, 30 seconds, "Bright object flew across, then disappeared.", 10/9/2015
2015-09-28T20:29:00Z, Kettering, OH, Other, 1 minute, "Six orange lights in the northern sky, originally in a formation until moving around and fading away.", 9/29/2015
2015-09-27T17:45:00Z, Fremont (west of; on I-90 ), OH, Other, 15 minutes ?, "Black hot air balloon shaped object that didn't appear to move. Stayed same shape, size and apparent direction of Toledo, OH/Lake Erie", 9/29/2015
2015-09-26T20:15:00Z, Howard, OH, Rectangle, 15 minutes, "It had three lights, 1 red, 1 blue/green, and a flashing white light on the bottom. It moved slow, had no sound, was black in color.", 9/29/2015
2015-09-24T17:30:00Z, Pataskala, OH, Disk, 4-6 minutes, UFO observed in the daytime sky by two individuals., 10/9/2015
2015-09-23T23:00:00Z, Athens, OH, Unknown, On going, "Stationery r, w, g lights 1hr+ NE Athens, OH. ((NUFORC Note: Possibly ""twinkling"" star?? PD))", 9/25/2015
2015-09-21T23:00:00Z, Crown City, OH, Sphere, 2 hours, "Stationary flashing multi color lights in northern sky. ((NUFORC Note: Possible ""twinkling"" star? PD))", 9/25/2015
2015-09-21T00:15:00Z, Fairborn, OH, Light, hours, Blinking lights that move suddenly in the sky., 9/25/2015
2015-09-20T21:30:00Z, Columbus, OH, Light, 10 minutes, "Amber Lightballs, six in series, spaced about two minutes apart track across sky at relatively low altitude and airspeed.", 9/25/2015
2015-09-20T04:30:00Z, Jefferson, OH, Orb, 1 hour, Multi-color orb blinking on and off and moving around the sky. ((NUFORC Note: Possible sighting of Venus? PD)), 10/9/2015
2015-09-18T21:15:00Z, Dublin, OH, Light, 2 minutes, "Two incredibly bright lights, side by side", 9/25/2015
2015-09-18T05:30:00Z, Circleville, OH, Other, 2-3 minutes, "2 ""space worms"" on a pre-dawn outing over central Ohio.", 11/4/2016
2015-09-18T04:45:00Z, Pataskala, OH, Changing, still going on, Bright objects hovering in the sky that changed shape and flashed multiple colors. ((NUFORC Note: Venus?? PD)), 9/25/2015
2015-09-16T19:30:00Z, Ashtabula, OH, Light, 2 minutes, Three lights in close proximity to each other seen hovering very high altitude over Ashtabula county then disappear, 9/17/2015
2015-09-15T22:30:00Z, Miamisburg, OH, Cone, 2 minutes, There was a big orange glow but when I snap the picture this is when I got as soon as I snapped a picture it disappeared also it was a, 9/17/2015
2015-09-14T22:00:00Z, Chardon, OH, Triangle, 7 minutes, It wasn't that high up because I could make out a lot of detail. Perfect triangular shape with fainter white lights at all 3 points., 9/25/2015
2015-09-13T23:00:00Z, Dublin, OH, Light, 1-2 minutes, 5-6 red lights with faint orange rim traveling a slow speed from north to south like a small aircraft, 9/17/2015
2015-09-13T22:00:00Z, Twinsburg, OH, Diamond, 30 minutes, "Diamond shaped lights, bright white in center and north and south points, red pulsating lights on east and west points.", 9/17/2015
2015-09-09T05:45:00Z, Columbus, OH, Light, 30 seconds, "Bright light in sky quickly turns into miniscule light, then nothing.", 9/11/2015
2015-09-08T18:30:00Z, Westerville, OH, Cigar, 15 secs, Cigar craft travels N to S in early evening sky; night-time sightings throughout month of Sept, 10/2/2015
2015-09-06T20:49:00Z, Amelia, OH, Light, 30, Orange/red lights in sky traveling Northwest, 9/11/2015
2015-09-05T21:15:00Z, Elyria, OH, Fireball, 4 minutes, We went out the door and we saw a Fireball same size as the moon moving at approximately 5 miles an hour up in the sky in front of us., 9/11/2015
2015-09-05T21:00:00Z, Dublin, OH, Fireball, 2 minutes, "Oval, orange-white, large candle/fireball floated slowly across the sky at a smooth, steady speed.", 9/11/2015
2015-09-02T11:18:00Z, Wadsworth, OH, Fireball, 10 minutes, A yellowish/orange fireball colored circle with white lights on the side., 9/11/2015
2015-08-29T21:45:00Z, Dayton, OH, Light, 5, Constellation of moving bright lights high in the sky., 9/2/2015
2015-08-29T21:00:00Z, Louisville, OH, Triangle, 10 minutes, "Driving home from work and I saw a pinkish light above the tree line over the Trump ave exit in Canton, heading towards Louisville. Th", 9/2/2015
2015-08-29T08:30:00Z, Twinsburg, OH, Other, 10-15 minutes, We noticed 2 orange glowing objects then a 3 rd. In the eastern hemisphere, 9/2/2015
2015-08-29T06:00:00Z, Blacklick, OH, Circle, >40 minutes, Bright circle in sky standing still., 9/2/2015
2015-08-22T22:00:00Z, Lynchburg, OH, Fireball, 10 minutes, "A floating fireball, like a floating campfire in sky, floating above house outside of Lynchburg, Ohio", 8/27/2015
2015-08-22T21:00:00Z, Delaware, OH, Oval, 15 minutes, Orange-white lights move over tree line and then disappear into sky, 8/27/2015
2015-08-19T00:00:00Z, Urbana, OH, Diamond, 5 minutes, "Large diamond shaped craft hovering 100 yards off highway near Urbana, Ohio. Had red and green lights with bright spotlight.", 8/27/2015
2015-08-18T22:00:00Z, Chillicothe, OH, Triangle, 10 seconds, Amber colored lights in triangle pattern with smaller light in center., 8/27/2015
2015-08-18T21:30:00Z, Lima, OH, Light, 2 minutes, Saw a very bright white light., 8/27/2015
2015-08-15T23:45:00Z, Lima, OH, Other, 5 minutes, "Vertical, pencil-shaped, object seen.", 8/27/2015
2015-08-15T22:42:00Z, Lakewood, OH, Light, 30 seconds, Twinkling amber star like UFO shot straight up into the night sky from tree tops in disappeared over Lakewood/Rocky River OH, 8/27/2015
2015-08-15T22:00:00Z, Cincinnati, OH, Triangle, 2 minutes, Triangular craft with 2 big bright red lights., 8/27/2015
2015-08-14T21:00:00Z, Loveland, OH, Fireball, unsure as just driving by, "4 clustered, orange, moving objects around 9 at night.", 8/27/2015
2015-08-13T12:00:00Z, Wooster, OH, Fireball, fireball, Rotating fireball with bright white light., 9/17/2015
2015-08-13T01:30:00Z, Lima, OH, Circle, 5 minutes, Pale circular yellow light passed overhead travelling West to East. I observed no red or green flashing lights on it. I heard no soun, 8/27/2015
2015-08-12T22:00:00Z, Delaware, OH, Light, 5 seconds, Drone light., 8/13/2015
2015-08-12T20:50:00Z, Sunset Beach, OH, Triangle, 5 minutes, 3 red/orange lights with white center in a triangle formation hovering for a while then fading away, 8/27/2015
2015-08-12T02:30:00Z, Hilliard, OH, Oval, 15 seconds, "Orb over Dublin, OH.", 9/2/2015
2015-08-10T11:45:00Z, Streetsboro, OH, Changing, 15 minutes, "Strange lights with strange movements, then vanished twice!!! Then heard humming.", 8/13/2015
2015-08-08T22:00:00Z, East Fultonham, OH, Fireball, 10 minutes, Date: 08/08/2015. Time: Approximately 2100hours Witnessed by Three aduklts and three children., 8/27/2015
2015-08-06T00:00:00Z, Tuscarawas County, OH, Cylinder, , ((HOAX??)) white cylinder roughly between 1.5 mile long and .5 mile long., 8/13/2015
2015-08-05T06:05:00Z, Groveport, OH, Triangle, 2 minutes, Taking pics of the sunrise at work and was going through the 5 pics when i noticed them in the top of the picture 4 together side by s, 8/6/2015
2015-08-05T03:15:00Z, Hudson, OH, Unknown, 20 minutes, Strange communicating high-pitch whistling sounds., 8/6/2015
2015-08-02T22:40:00Z, Reynoldsburg, OH, Sphere, 4 minutes, "Sphere, high in sky, west to east. Very high speed, stopped on a dime, elevated, lowered and continued.", 8/6/2015
2015-08-02T22:00:00Z, Johnstown, OH, Orb, 5 seconds, "Bright red orb/light, perfect circle, fuzzy, faded into nothing. Only lasted a few seconds. No sound.", 8/13/2015
2015-08-01T22:45:00Z, Powell, OH, Cone, 1-2 minutes, Very large orange/red circle with conicle rear; Appeared to have a tail/trail or be on fair at the rear., 8/6/2015
2015-08-01T00:30:00Z, Miamisburg, OH, Disk, 2 minutes, My b.f. and I were stargazing on our back porch after I told him I saw a very vivid and long falling star trail., 8/6/2015
2015-07-31T23:00:00Z, Dublin, OH, Triangle, fast, ((HOAX??)) triangle craft with bright green lights and fast not very loud at all., 8/6/2015
2015-07-31T04:20:00Z, Medina, OH, Sphere, 6 seconds, "Silent, bright sphere, passes over city of Medina.", 7/31/2015
2015-07-29T21:48:00Z, Grove City, OH, Orb, 5 minutes, Red pulsing orb moving silently across the sky., 7/31/2015
2015-07-26T21:00:00Z, Mentor, OH, Unknown, 4 minutes, The first thing that came to mind was that these beams of red light were linking with my total being., 8/13/2015
2015-07-24T23:00:00Z, Delaware, OH, Sphere, 5 minutes, "Red/orange sphere hovering over Delaware, Ohio.", 7/31/2015
2015-07-24T10:45:00Z, Akron, OH, Rectangle, 2 minutes, "Rectangular, almost square, a little smaller than the Goodyear blimp, no lights, gray color", 7/31/2015
2015-07-23T22:40:00Z, Sagamore Hills, OH, Light, 30 seconds, One light being chased by three helicopters., 7/31/2015
2015-07-23T00:15:00Z, North Ridgeville, OH, Fireball, 30 seconds, "West sky, flaming red fireball. Looked huge.", 7/31/2015
2015-07-16T01:00:00Z, Eton, OH, Disk, , ((HOAX??)) it was wight, 7/17/2015
2015-07-15T21:50:00Z, Columbus, OH, Changing, 1-2 minutes, I was outside with my younger brothers they had went inside but shortly after these lighs fly at angle at a distance they did not forum, 7/17/2015
2015-07-11T23:45:00Z, Negley, OH, Cylinder, Present, "Slow moving cylinder shaped flashing red lights over tree line on Lake Tomahawk, Negley, OH 23:45 07/11/15", 7/17/2015
2015-07-11T22:15:00Z, Oregonia, OH, Orb, 3 minutes, "My wife, myself and my granddaughter witnessed a large orange orb hovering low in the sky. It changed to 3 orbs disappeared. Then back", 7/17/2015
