Date/Time, City, State, Shape, Duration, Summary, Posted
2023-07-19T17:31:00Z, Dayton, OH, Disk, ~25 seconds, "Reflective disk in broad daylight, headed at 11 degree bearing (south, slightly west)", 7/29/2023
2023-07-13T23:15:00Z, SANDUSKY, OH, Fireball, 3 -5 seconds, Blue light of fire with a flat bottom, 7/29/2023
2023-07-12T23:36:00Z, Fairview Park, OH, Cylinder, 4 seconds, Saw a definitive tick tac like object the size of a dime at arms length about 35 degrees above horizon through sky light window., 7/29/2023
2023-07-11T23:00:00Z, The Plains, OH, Star, 20 minutes, "Looked as bright as a planet, shape can not be determined", 7/29/2023
2023-07-09T23:15:00Z, North Myrtle Beach, OH, Light, 45 Seconds, Light appeared about 25 ft above my head and moves to the right of me and went over the building to my right and disappeared., 7/10/2023
2023-07-09T21:00:00Z, Saint Clairsville, OH, Circle, 7 minutes, Witnessed and videoed floating orb in the sky., 7/29/2023
2023-07-05T23:38:00Z, Reno, OH, Light, 5-7 seconds, Rapidly moving bright light curved and faded into nothing, 7/10/2023
2023-07-05T10:45:00Z, Canal Winchester, OH, Changing, 15 minutes, Saw what appeared to be a large round ball in the sky that became elongated, 7/29/2023
2023-06-25T20:46:00Z, Elida, OH, Oval, 1- 2 minutes, "From the naked eye, object 1 and 2 appeared like a tic tac round shape.", 7/10/2023
2023-06-24T22:35:00Z, Dennison, OH, Circle, 10 minutes, 3 small white orbs moving quickly and changing around formation in ways not aerodynamically possible for human planes. No blinking, 7/10/2023
2023-06-22T13:45:00Z, Cleveland, OH, Chevron, 1 minute, "Blended in with clouds, thought it was a bird, but it reflected light and it was maneuvering quickly, not like a plane.", 7/10/2023
2023-06-02T22:55:00Z, AKRON, OH, Light, 20 seconds?, "Witnessed object moving from left to right in a straight line. Object started dim, became bright, went dim, made weird maneuver, gone.", 7/10/2023
2023-06-02T01:21:00Z, Lakewood, OH, Diamond, 20 seconds, "It was triangular, white, glowing, and soundless", 7/10/2023
2023-06-01T13:55:00Z, Sylvania, OH, Changing, About 5 min, "Two crafts without noise, floating but would change shape and move so fast and reappear. Looked like the lights was a reflection", 7/10/2023
2023-06-01T04:00:00Z, mansfield/miffland, OH, Changing, about 30 seconds, I was at work on on a trash truck when a tall figure peeked at me. We never broke eye contact and it hunched over and ran to the woods., 7/10/2023
2023-05-31T21:46:00Z, LIBERTY TOWNSHIP, OH, Changing, 3 hours for days, "Looks like a space craft, second picture when it moved and can see an angelic figure", 7/10/2023
2023-05-29T18:08:00Z, New Lebanon, OH, Unknown, 30 seconds, We saw a very strange craft traveling west at a very high speed that appeared to have the main craft up top with a strange form under, 7/10/2023
2023-05-24T21:49:00Z, Mansfield, OH, Light, 3 1/2 hrs, Seen bright light in the sky due north west, 7/10/2023
2023-05-23T22:31:00Z, Canton, OH, Circle, 3 minutes+ to pass, "Ball of light passsed from south to north, following I-77.", 7/10/2023
2023-05-07T23:07:00Z, North Ridgeville, OH, Oval, 6/22 thru 5/23, Every night behind Hardwood Dr, 5/19/2023
2023-05-06T01:32:00Z, Reedsville, OH, Light, 2 mins, Noticed 2 very distinct light orange/yellowish lights low In the night sky. Once stopped the object moved towards me silently at 500 ft, 7/10/2023
2023-05-04T21:25:00Z, Newark, OH, Orb, 2 minutes, Walking outside and looked up., 5/19/2023
2023-04-25T04:38:00Z, Mt. Vermon, OH, Orb, It was a few seconds to f, I was driving forward up the hill and I saw something very bright just fall to the ground, 5/19/2023
2023-04-25T04:32:00Z, Columbus, OH, Light, , Green lighting and moving fast it flew buy pretty quick u saw it then it was gone, 5/19/2023
2023-04-20T23:17:00Z, Dublin, OH, Cylinder, 5 minutes, Bright orange aircraft, 5/19/2023
2023-04-13T23:00:00Z, Miamisburg, OH, Orb, 1 minute, "Twins, streaking the sky at the Same speed running somewhat parallel to each other", 5/19/2023
2023-04-12T17:15:00Z, Columbus, OH, Orb, 1 minute or so, Saw flying orb, 7/10/2023
2023-04-10T20:09:00Z, Lima, OH, Cylinder, 3 minutes, "Driving, spotted object coming down from sky before making turn. Believe it may have hit the ground", 5/19/2023
2023-04-09T23:00:00Z, Wooster, OH, Other, 20 minutes or so, "Flashing green red and blue, spinning cone like craft, hovering", 5/19/2023
2023-04-09T23:00:00Z, Chesapeake, OH, Changing, 8 minutes, Watched hovering among tree tops multiple lights moving horizontally and vertically as if they were searching for something, 5/19/2023
2023-04-06T22:54:00Z, Lakemore, OH, Circle, 2 minutes and 39 seconds, Something in circular or conical shape giving of a blinking light while attempting to be unseen or cloaked by a cloud., 5/19/2023
2023-03-31T06:35:00Z, Athens, OH, Disk, About 2 minutes, I seen an odd flying object and I stopped and got a video, 4/9/2023
2023-03-30T23:34:00Z, elyria, OH, Sphere, 3 min, helicopter circling close to an low object that was silent with a very bright flashing red and blue object, 5/19/2023
2023-03-26T06:00:00Z, Centerville, OH, Other, 10 secs, See details, 4/9/2023
2023-03-26T05:55:00Z, Toronto, OH, Unknown, 10 min, Vertical line of lights, 4/9/2023
2023-03-20T21:10:00Z, Canton, OH, Orb, 3-4mins, "7-8 bright orange orbs flying silently and slowly above the house tops, across the housetops but relatively low.", 7/29/2023
2023-03-01T19:08:00Z, Barberton, OH, Other, 25 minutes plus, Two lights high in the sky stationary very large and bright. Seen clouds moving infront of it. NUFORC Note: Jupiter and Venus, 3/6/2023
2023-02-28T19:34:00Z, Canton, OH, Sphere, 30m (+), 2 circular objects with spinning center, 4/9/2023
2023-02-28T18:16:00Z, Tipp City, OH, Egg, 5 minutes, White tic tac or egg shape flying object, 5/19/2023
2023-02-25T20:30:00Z, Jackson, OH, Light, Seconds, A fast moving white light., 3/6/2023
2023-02-25T20:30:00Z, Lexington, OH, Unknown, 30 min, Took photos. Lights on it. stayed in one spot 20 min then moved slightly then gone. NUFORC Note: Jupiter and Venus, 3/6/2023
2023-02-22T19:05:00Z, Wellston, OH, Circle, Roughly 5 minutes, I saw what looked like a star in the sky but it was moving to the left., 3/6/2023
2023-02-21T19:30:00Z, Wooster, OH, Disk, 1 hour, Light hovering back and forth in the sky for unknown period of time., 3/6/2023
2023-02-20T04:10:00Z, Avon Lake, OH, Unknown, 45 seconds max, Chilling audio encounter like nothing I have ever experienced., 3/6/2023
2023-02-19T22:30:00Z, Cuyahoga falls, OH, Circle, 20 minutes, A single ufo sighting from kitchen window., 3/6/2023
2023-02-19T19:35:00Z, Canton, OH, Light, 2 minutes, Looked like a missle was fired. The exhaust quickly disappeared., 3/6/2023
2023-02-13T17:17:00Z, Gypsum, OH, Cylinder, In sight for 1 minute, "Looked overhead while outside with coworker, multiple planes, yet this object was moving faster with no sound or trail.", 3/6/2023
2023-02-12T21:30:00Z, Bucyrus, OH, Light, Over hour, Light with glow around seen east of city then to west of city then disappeared, 3/6/2023
2023-02-12T19:45:00Z, Arcanum, OH, Formation, Approx 3 minutes, Large straight line formation from western horizon rapidly dimming out after passing overhead., 3/6/2023
2023-02-12T19:40:00Z, Grand Rapids, OH, Formation, 45 seconds, "Not an airplane. String of lights. No air noise. No banner. it was going for about 45 seconds, maybe a minute and then disappeared.", 3/6/2023
2023-02-12T19:39:00Z, Liberty Township, OH, Changing, About 3-5 minutes, "A long train like glowing on and off light, that was moving slow then eventually all lights turned off!", 3/6/2023
2023-02-12T19:38:00Z, Twinsburg, OH, Cigar, About 3 minutes, A line of bright lights that was constant; couldn't see the craft disappeared right above me, 3/6/2023
2023-02-12T18:15:00Z, Waterville, OH, Oval, 1 minute, Something that I've never seen before in the sky, 3/6/2023
2023-02-12T17:19:00Z, Columbus, OH, Sphere, Sharp Shiny metal object, I have video tape, 3/6/2023
2023-02-09T19:16:00Z, Newark, OH, Cone, 10 to 12 minutes, Many flashing lights following a bigger object, 3/6/2023
2023-02-09T17:45:00Z, Cleveland, OH, Cylinder, 5 minutes, We were watching a plane when we noticed this, 3/6/2023
2023-02-09T03:30:00Z, Austintown, OH, Circle, Lasted about ten minutes, "Well I seen the flying object, three of them very bright lights could see much because these light were so bright were not airplanes", 5/19/2023
2023-02-06T23:06:00Z, Van Buren, OH, Other, 5 minutes, Object to the north, 3/6/2023
2023-02-03T17:25:00Z, Mentor, OH, Circle, A secongy, Saw a white bright light go up to a cloud., 3/6/2023
2023-02-02T20:30:00Z, Bremen, OH, Chevron, Around 20 seconds, "Let the dog out for RR, Looked into sky, saw a translucent bird shaped object with no noise, no light, and no flapping of wings.", 5/19/2023
2023-01-28T20:30:00Z, Mount vernon, OH, Light, 30 seconds, "Low-flying object, 3 lights in a straight line, moving slowly, no noise.", 3/6/2023
2023-01-21T19:29:00Z, Athens, OH, Light, over 10 minutes, "Green, blue, purple, and white flashing light", 3/6/2023
2023-01-15T15:23:00Z, Columbus, OH, Orb, 2 minutes, Orb hovering over our house, 3/6/2023
2023-01-09T20:00:00Z, Wilmington, OH, Unknown, Zero, Followup to my earlier report, 3/6/2023
2023-01-09T08:00:00Z, Wilmington, OH, Unknown, Approximately 20 minutes, Colorful spot in the sky, 3/6/2023
2022-12-23T17:25:00Z, Homeworth, OH, Unknown, 5 min, Took pictures with cell phone, 3/6/2023
2022-12-21T21:33:00Z, Columbus, OH, Light, 1-2 minutes, 4-5 orange balls of light in a straight line, 12/22/2022
2022-12-20T21:58:00Z, Mentor Headlands, OH, Cylinder, A few minutes, "Looked cylindrical from the lights, changing colors from white to red to orange then yellow back to white, .", 12/22/2022
2022-12-13T12:07:00Z, Kent, OH, Cross, 40 seconds, "I thought at first this might be a plane making its way upwards, soon to see that it was remaining stationary.", 12/22/2022
2022-12-02T04:45:00Z, 200 miles East of ORD at 39000 feet traveling east, OH, Orb, Aproximatly 20-30 min, 3 bright objects moved at high speed in a lower orbit or lower in irregular pattern.((NUFORC Note: Report from airline pilot. PD)), 12/22/2022
2022-12-01T18:45:00Z, Elyria, OH, Triangle, , So many of them, 12/22/2022
2022-12-01T18:10:00Z, Blakeslee, OH, Sphere, 5 minutes, Bright spherical object moving linear west to east at 20 thousand feet high., 12/22/2022
2022-11-23T11:27:00Z, Independence, OH, Disk, 40 seconds, "UFO displaying advanced camouflage, it showed an outline of itself when it went over power lines, it seemed to reflect light around", 12/22/2022
2022-11-22T21:04:00Z, Ashley, OH, Changing, about 20 mins, "I saw an circle ball flashing from blue, to green, to clear moving erratically very fast up, down and side to side. Then it changed sh", 3/6/2023
2022-11-09T01:30:00Z, Elyria, OH, Fireball, >5 seconds, A fireball like object appeared out of nowhere and streaked away., 12/22/2022
2022-11-09T01:30:00Z, Elyria, OH, Fireball, 2-4 seconds, Fireball that picks a direction and flies away, 12/22/2022
2022-11-08T20:40:00Z, Antwerp, OH, Unknown, 3 minutes, Large object flying in sky silently, 12/22/2022
2022-11-08T17:23:00Z, Mansfield, OH, Changing, 2 min, I saw 3 stationary lights in a very clear sky which then disappeared one by one and reappeared in a different formation further south, 12/22/2022
2022-11-03T21:22:00Z, Stoutsville, OH, Circle, , "Round with several others, so bright you couldn't stare at it.", 12/22/2022
2022-11-03T21:22:00Z, Laurelville, OH, , , MADAR site 107 had spike on magnetometer plus compass variation., 7/10/2023
2022-11-03T18:53:00Z, Columbus, OH, Cylinder, 3 seconds, It was a a flash of blueish light in the sky that zipped forward really quickly then just disappeared., 12/22/2022
2022-11-03T17:00:00Z, Sandusky, OH, Other, unsure, Saw UFO with red and white flashing lights, 12/22/2022
2022-11-02T21:43:00Z, Columbus, OH, Light, 6 seconds, Odd S shaped flight pattern at high speed, 12/22/2022
2022-11-01T21:11:00Z, Byesville, OH, Circle, All night, They are everywhere flying above tree tops. Very scared send help, 12/22/2022
2022-10-29T21:28:00Z, North Royalton, OH, Orb, 2 minutes, We saw a light moving very fast approaching and it was too high for a plane and way to fast, 12/22/2022
2022-10-28T17:05:00Z, Montgomery, OH, Changing, Over 1 hour, Beautiful day sitting in the hot tub Saw multiple objects moving in the sky. Have multiple videos., 12/22/2022
2022-10-26T03:30:00Z, Marietta, OH, Other, "6 minutes, approximate", Heard the sound outside. Picture of something in the window. Missing time., 12/22/2022
2022-10-24T07:00:00Z, Cincinnati, OH, Circle, 3 minutes, I was taking time lapses of sunrise when I notice a bright light come out of one cloud and float to another, 12/22/2022
2022-10-24T06:52:00Z, Holmesville, OH, Triangle, 2 Minutes, Triangle shaped object moving steadily across sky, 12/22/2022
2022-10-23T23:42:00Z, Garfield Hts, OH, Unknown, 25 minutes and county, "Three in vertical line, two on horizontal ends flickering", 12/22/2022
2022-10-23T20:30:00Z, Mount Vernon, OH, Triangle, I filmed for 3 1/2 minute, "I filmed the object for 3 1/2 minutes, until it went straight up, and disappeared.", 12/22/2022
2022-10-23T19:00:00Z, Columbus, OH, Unknown, 1-2 min, Bright sphere at night, 12/22/2022
2022-10-20T20:04:00Z, Washington Court House, OH, Circle, Seconds, Bright orange lights triangle shape, 12/22/2022
2022-10-20T02:12:00Z, Toledo, OH, Light, 10 min, This is our second time seeing this bright light, 12/22/2022
2022-10-20T01:43:00Z, Amherst, OH, Circle, 1-2 seconds max, "We were driving and infront of us a very large blue circle craft thing, flew and disappeared infront us within 1-2 secs it was gone", 12/22/2022
2022-10-19T20:00:00Z, Centerburg, OH, Circle, 39 seconds, Glowingly ball of light Chang shape instantly disappearing, 12/22/2022
2022-10-16T19:13:00Z, Columbus, OH, Light, , Flying lights, 12/22/2022
2022-10-15T20:29:00Z, Chesterland, OH, Unknown, 4 minutes, Super bright white flashing bright then dim kinda sparkling- but NOT a planet- not a meteor or aircraft., 12/22/2022
2022-10-15T19:17:00Z, East Liverpool, OH, Circle, about 3 minutes, "Did not appear to be satellites or lanterns, I've seen those before, never seen anything like these before", 12/22/2022
2022-10-14T20:30:00Z, Piqua, OH, Oval, Lasted approximately 10 m, Witnessed several orbs along with circling helicopters, 12/22/2022
2022-10-14T16:49:00Z, Carrollton, OH, Circle, Picture, In a field, 12/22/2022
2022-10-13T20:00:00Z, Manchester, OH, Light, 30-40 minutes+, "My wife and I were sitting outside by our fire ring when I noticed a light to the north east that was moving, coming to a complete stop", 12/22/2022
2022-10-11T04:56:00Z, Pickerington, OH, Rectangle, 20 seconds, A flying object silently hovering over my neighbors house with very bright lights, 12/22/2022
2022-10-09T15:30:00Z, CINCINNATI, OH, Circle, 5-8 seconds, bright small but bright silver/white spherical object zooming across the sky then simply disappearing, 4/9/2023
2022-10-07T19:49:00Z, New Albany, OH, Triangle, 5min, Triangle with red lights, 12/22/2022
2022-10-04T04:12:00Z, Sagamore Hills, OH, Sphere, Over 6 minutes, Saw/recorded light ball/orb in front yard from live security camera, 12/22/2022
2022-10-04T04:12:00Z, Sagamore Hills, OH, Sphere, 6 minutes, Ball of light hovering in front yard, 12/22/2022
2022-09-30T00:30:00Z, "New Miami, Ohio (Hamilton Ohio)", OH, Sphere, Has not disappeared, "There were 2 consistent visible spheres. 1 was lower and glowing and flashing red, the other was white and moving frequently", 10/8/2022
2022-09-24T11:16:00Z, Warren, OH, Egg, 12 minutes, "A bean shaped flying object roaming in one straight line then moving erratically, it followed a known aircraft", 10/8/2022
2022-09-23T21:20:00Z, Moraine, OH, Disk, 1 minute, "A bright object appeared in the sky, something dropped from it and started falling towards earth . The object then disappeared while.", 10/8/2022
2022-09-15T21:49:00Z, Marysville, OH, Light, 16 seconds, "Bright ""white sparking"" lights really high in night sky.", 10/8/2022
2022-09-15T03:00:00Z, Greenville, OH, Oval, 5 seconds, "Two portals open up in sky real low. Oval white capsule came out and enter second potral, all with no sound", 3/6/2023
2022-09-10T19:30:00Z, WESTLAKE, OH, Light, 1-2 s, Fast large lights in night sky, 10/8/2022
2022-09-05T22:30:00Z, Middletown, OH, Light, "30 seconds, maybe less", "Incredibly bright flash, small sphere of light in distant sky streaks off", 10/8/2022
2022-09-01T21:09:00Z, Wheelersburg, OH, Disk, 1 minute, So we were walking to our house and we saw a UFO and it was VERY big!, 9/9/2022
2022-08-31T22:11:00Z, Vandalia, OH, Star, 15 mins, Looked like a regular star in the sky, 10/8/2022
2022-08-28T09:32:00Z, Toledo, OH, Cigar, 2-4 minutes, Solid black no wings or tail fin. Seen while flying from Philadelphia to Las Vegas I have a 12 second video, 12/22/2022
2022-08-27T21:00:00Z, New Albany, OH, Orb, I was driving on 161, There were about 8 glowing orangish yellow spheres and another two off to the right., 9/9/2022
2022-08-25T23:30:00Z, Byesville, OH, Changing, Been every night since sa, Bright light first time speeding extremely fast watched it stop and go down that light was bright white, 12/22/2022
2022-08-24T21:20:00Z, Wilmington, OH, Triangle, 20 seconds, "Three amber lights spinning slowly, made a full rotation then individually turned off", 9/9/2022
2022-08-24T20:40:00Z, Wilmington, OH, Unknown, A couple minutes, Amber looking lights almost triangular or oval. There was at first what I thought was 2 but it after zooming more like 5, 9/9/2022
2022-08-24T15:30:00Z, Gallipolis, OH, Egg, 5 min, "It was gold in color, stationary over the runway, then it shot off like a bullet to the North.", 5/19/2023
2022-08-24T15:16:00Z, Columbus, OH, Orb, 30 Minutes, ORB / UFO floating over our house for a half hour..., 9/9/2022
2022-08-23T21:46:00Z, Circleville, OH, Circle, 20 Minutes, 3 lights signal each other, 9/9/2022
2022-08-23T21:00:00Z, Chillicothe, OH, Light, Less than a minute, "Three very bright lights appeared suddenly, silently and hovered", 9/9/2022
2022-08-20T21:10:00Z, Cincinnati, OH, Light, 5 minutes, "My wife and 3 out of 4 of my children witnessed the sighting, the youngest are twins age 10.", 9/9/2022
2022-08-18T19:30:00Z, Leavittsburg, OH, Oval, 50 minutes, I could see a translucent oval shape in the clouds., 9/9/2022
2022-08-15T13:25:00Z, West Chester, OH, Cross, 10 seconds, "Saw large white cross-shaped craft drifting north. Elevation near clouds. After viewing for a few seconds, the object vanished.", 9/9/2022
2022-08-13T21:20:00Z, Doylestown, OH, Unknown, , Circling lights, 9/9/2022
2022-08-13T01:30:00Z, Cleveland, OH, , 2 hours, Tone in the air., 9/9/2022
2022-08-08T23:45:00Z, Cincinnati, OH, Formation, 5 seconds, "Almost midnight, two dark unlit objects, maybe boomerang shaped, flying close formation, glided by swiftly and silently", 9/9/2022
2022-08-07T03:30:00Z, Lebanon, OH, Unknown, 3 minutes, "A vertically orientied and tight collection of dozens and dozens of random, blinking lights.", 9/9/2022
2022-08-07T00:04:00Z, GROVE CITY, OH, Orb, approximately 7 minutes, "Sky brightened by large orange sphere that looked like the sun shortly after midnight, slowly dimmed and then descended below tree line", 10/8/2022
2022-08-04T23:25:00Z, Gahanna, OH, Triangle, About 20-40 seconda, Saw what appeared to be a triangle shaped craft with 5 lights coming from it. Appeared like headlights, 9/9/2022
2022-07-31T21:59:00Z, West Lafayette, OH, Light, 4 minutes, Bright circle light moving through sky., 9/9/2022
2022-07-26T21:31:00Z, Chagrin Falls, OH, Oval, 2-3 minutes, "Large oval shape object with black dot in the middle, varying in intensity with two additional orbs rotating around the main one.", 9/9/2022
2022-07-25T22:00:00Z, Sandusky, OH, Cigar, 20 minutes, Observed the first craft on my way back to my room and then observed two more craft before running outside to call parents and record., 9/9/2022
2022-07-22T22:25:00Z, Dublin, OH, Cigar, 2-3 minutes, "Saw an object moving straight down slowly, as we were watching it, several lights lit up consecutively and then it disappeared.", 9/9/2022
2022-07-21T21:46:00Z, Dayton, OH, Circle, 40 Seconds, The UFO was seen low to the ground at high speeds., 9/9/2022
2022-07-15T22:00:00Z, COLUMBUS, OH, Light, About 20 to 40 minutes, "Light at long distance that rose vertically, dropped about 10 degrees and then remained stationary and pulsed about once per second.", 9/9/2022
2022-07-15T14:20:00Z, Columbus, OH, Other, Few minutes, Craft was in the shape of a ring. My son called it Sonic’s ring., 9/9/2022
2022-07-12T20:08:00Z, Sebring, OH, Unknown, Odd object moving through, Quiet revolutionary object unbelievably foreign to the sight., 9/9/2022
2022-07-10T00:10:00Z, Franklin, OH, Orb, About 1 minute and 15 sec, "It was a glowing red orb with a tail, then it stopped and was a fuzzy red ball. There were no other colors.", 9/9/2022
2022-07-07T20:30:00Z, Huron, OH, Disk, 15 m. multiple witnesses, I saw the object hovering untill I began travelling northbound the object slowly and silently drifted north northeast out of sight., 9/9/2022
2022-07-03T20:57:00Z, Tipp City, OH, Egg, 30 seconds, I saw a egg shaped flying object transmitting 2 white lights, 9/9/2022
2022-07-01T21:50:00Z, Lancaster, OH, Light, 1-2 Minutes, Slowly pulsing green light with white light underneath., 9/9/2022
2022-06-30T09:35:00Z, Mansfield, OH, Cylinder, 10 seconds, The bright silver object was moving West to East, 9/9/2022
2022-06-24T22:33:00Z, Strongsville, OH, Cylinder, One minute, Craft made hairpin U turn, 9/9/2022
2022-06-23T19:00:00Z, Cincinnati, OH, Circle, 8 min, 6 different circles switching positions in the air, 9/9/2022
2022-06-23T02:00:00Z, Lancaster, OH, Cross, Mid June 2 nights in a ro, I saw a craft go fast in one direction and turned and went another direction and disappeared two nights in a row., 9/9/2022
2022-06-19T02:20:00Z, Senecaville, OH, Unknown, 5 minutes, We saw a ring of light in the sky coming from an object far away, 6/22/2022
2022-06-16T17:42:00Z, Lore City, OH, Disk, 1 second, filming the lightning during the Tstorm we were having. Later I reviewed the video and at about 4 sec I noticed something cross frames, 6/22/2022
2022-06-06T14:30:00Z, Chillicothe, OH, Disk, I’m not exactly sure, All I remember is what I assume the end of the abduction was., 3/6/2023
2022-06-04T10:42:00Z, ashtabula, OH, Orb, 45 minutes, "Faint glowing light, orb like but more cloudy appearance", 6/22/2022
2022-06-03T23:30:00Z, Eastlake, OH, Triangle, A few hours, I saw three lights making up a triangle. I took a photo then switched to night vision and the shape was then illuminated, 6/22/2022
2022-05-31T22:00:00Z, Medina, OH, Star, approx 1 minute, looked like A very very bright Venus in the northern sky, 6/22/2022
2022-05-29T23:15:00Z, Cincinnati, OH, Other, 20 seconds, To me it look like a flying wing nut, 6/22/2022
2022-05-25T22:00:00Z, Southington, OH, Disk, Caught on night camera, CAught on night camera And it shows a disk with lights and in one photo shows rays of light coming downward almost like rays from the s, 6/22/2022
2022-05-20T20:17:00Z, Vanlue, OH, , 20 to 25 seconds, Have a picture I would like to send, 6/22/2022
2022-05-14T16:10:00Z, Mentor, OH, Rectangle, 4 minutes, Rectangle over the lake, 6/22/2022
2022-05-08T05:15:00Z, LAKEWOOD, OH, Circle, Longer than an hour, Seen 2 objects circular with lights Lakewood ohio, 5/31/2022
2022-04-26T21:38:00Z, Lewisburg, OH, Sphere, 1 minute, I was driving and I saw three sphere like objects moving in strange patterns I'm the sky., 5/31/2022
2022-04-24T22:20:00Z, Wooster, OH, Formation, About an hour, "Three small starlike objects in a perfect triangle, each one higher than the other and moving strangely - definitely not satellite", 5/31/2022
2022-04-23T22:00:00Z, Streetsboro, OH, Triangle, 10 to 15 seconds, I saw a large white triangular craft in orbit moving north to south, 5/31/2022
2022-04-22T11:00:00Z, Mansfield, OH, Cigar, 15 min, It was at least a mile long .all lite up ., 4/22/2022
2022-04-21T21:56:00Z, Akron, OH, Cigar, Approx 30 -45 seconds, What at first appeared to be a weird cloud moving east turned cigarshaped with lights on side then disappe, 4/22/2022
2022-04-21T21:50:00Z, Painesville, OH, Other, 2-3 mins. that we saw, Straight line of lights in formation, 4/22/2022
2022-04-21T21:50:00Z, Parma, OH, , 3 minutes approximately, "10-12 evenly spaced lights appearing in northwest sky travelling southeast, fading out one light at a time. ((Starlink satellites??))", 4/22/2022
2022-04-21T21:15:00Z, Madeira, OH, Light, About one minute, In my back yard I was when I seen this enormous light, 5/31/2022
2022-04-17T23:52:00Z, Cleveland, OH, Rectangle, 5 to 10 minutes, "Long organic like a train, cigar, serpent 2 football fields long.", 9/9/2022
2022-04-14T22:42:00Z, Avon, OH, Light, about 40 seconds, "Two sequential bright, motionless, silent lights", 4/22/2022
2022-04-12T12:15:00Z, Lebanon, OH, Rectangle, 3 minutes, Gray rectangle in the sky with small whitish square on the bottom center, 4/22/2022
2022-04-11T15:25:00Z, Cincinnati, OH, Disk, 3 seconds max, "Slowed down, stopped for maybe a second or two, then sped up and ""disappeared""", 4/22/2022
2022-04-08T21:03:00Z, Powell, OH, Disk, Several minutes, Saw what we thought was an airplane off in the distance., 4/22/2022
2022-04-07T19:05:00Z, Stow, OH, Unknown, Unknown saw in pictures, Saw something in one of two pictures I took seconds apart, 4/22/2022
2022-03-24T23:19:00Z, Plain City, OH, , 20 min ago, Saw dots flying through sky, 4/22/2022
